Authors,Title,Publication,Volume,Number,Pages,Year,Publisher
"Whiting, Daniel J; Keaveney, James; Adams, Charles S; Hughes, Ifan G; ",Direct measurement of excited-state dipole matrix elements using electromagnetically induced transparency in the hyperfine Paschen-Back regime,Physical Review A,93,4,043854,2016,APS
"Jones, Matthew; Randell, David; Ewans, Kevin; Jonathan, Philip; ",Statistics of extreme ocean environments: Non-stationary inference for directionality and other covariate effects,Ocean Engineering,119,,30-46,2016,Elsevier
"Flower, DR; ",Ultraviolet spectra of planetary nebulae–VIII. The C/O abundance ratio in the Ring nebula,Monthly Notices of the Royal Astronomical Society,199,1,15P-18P,1982,"Oxford University Press Oxford, UK"
"Flower, DR; ",Rotational excitation of hydrogen molecules by hydrogen atoms,Monthly Notices of the Royal Astronomical Society,288,3,627-630,1997,"Blackwell Science Ltd Oxford, UK"
"Abgrall, H; Le Bourlot, J; Pineau des Forêts, G; Roueff, E; Flower, DR; Heck, L; ",Photodissociation of H2 and the H/H2 transition in interstellar clouds,"Astronomy and Astrophysics (ISSN 0004-6361), vol. 253, no. 2, Jan. 1992, p. 525-536. Research supported by CNRS and British Council.",253,,525-536,1992,
"Dorr, M; Potvliege, RM; Shakeshaft, R; ",MULTIPHOTON PROCESSES IN AN INTENSE LASER FIELD. 3. RESONANT IONIZATION OF HYDROGEN BY SUBPICOSECOND PULSES,PHYSICAL REVIEW A,41,1,558-561,1990,"AMER PHYSICAL SOC ONE PHYSICS ELLIPSE, COLLEGE PK, MD 20740-3844 USA"
"Rogers, Joshua P; Gallagher, Liam AP; Pizzey, Danielle; Pritchett, Jon D; Adams, Charles S; Jones, Matthew PA; Hodges, Chris; Langbein, Wolfgang; Lynch, Stephen A; ",High-resolution nanosecond spectroscopy of even-parity Rydberg excitons in Cu 2 O,Physical Review B,105,11,115206,2022,APS
"Hutson, Jeremy M; ",Coupled channel methods for solving the bound-state Schrödinger equation,Computer Physics Communications,84,1-3,1-18,1994,Elsevier
"Pattinson, RW; Billam, TP; Gardiner, SA; McCarron, DJ; Cho, HW; Cornish, SL; Parker, NG; Proukakis, NP; ",Equilibrium solutions for immiscible two-species Bose-Einstein condensates in perturbed harmonic traps,Physical Review A,87,1,013625,2013,APS
"McCarron, Daniel J; Hughes, Ifan G; Tierney, Patrick; Cornish, Simon L; ",A heated vapor cell unit for dichroic atomic vapor laser lock in atomic rubidium,Review of Scientific Instruments,78,9,,2007,AIP Publishing
"Sakellari, E; Proukakis, NP; Adams, CS; ",Tunnelling induced collapse of an atomic Bose–Einstein condensate in a double-well potential,"Journal of Physics B: Atomic, Molecular and Optical Physics",37,18,3681,2004,IOP Publishing
"Guo, Zhichao; Jia, Fan; Zhu, Bing; Li, Lintao; Hutson, Jeremy M; Wang, Dajun; ",Improved characterization of Feshbach resonances and interaction potentials between Na 23 and Rb 87 atoms,Physical Review A,105,2,023313,2022,APS
"Holdaway, David IH; Weiss, Christoph; Gardiner, Simon A; ",Quantum theory of bright matter-wave solitons in harmonic confinement (18 pages) 053618,Physical Review-Section A-Atomic Molecularand Optical Physics,85,5,,2012,
"Bauer, Jaroslaw; Plucinski, Lukasz; Piraux, Bernard; Potvliege, Robert; Gajda, Mariusz; Krzywinski, Jacek; ",Ionization of hydrogen atoms by intense vacuum ultraviolet radiation,"Journal of Physics B: Atomic, Molecular and Optical Physics",34,11,2245,2001,IOP Publishing
"Danby, G; Flower, DR; Valiron, P; Schilke, P; Walmsley, CM; ",A recalibration of the interstellar ammonia thermometer,Monthly Notices of the Royal Astronomical Society,235,1,229-238,1988,"Oxford University Press Oxford, UK"
"Potvliege, Robert M; ",Waveletlike basis function approach to the propagation of paraxial beams,JOSA A,17,6,1043-1047,2000,Optica Publishing Group
"Cirac, JI; Gardiner, S; Pellizzari, T; Poyatos, J; Zoller, P; ",Synthesis of Entangled States and Quantum Computing,,,,,,
"Jones, Matthew; Goldstein, Michael; Jonathan, Philip; Randell, David; ",Bayes linear analysis for Bayesian optimal experimental design,Journal of Statistical Planning and Inference,171,,115-129,2016,Elsevier
"Pattinson, Robert; Parker, Nick; Proukakis, Nick; Liu, I; Gou, Shih-Chuan; Gardiner, Simon; McCarron, Daniel; Cho, Hung-Wen; Cornish, Simon; Billam, Tom; ",Structure formation in immiscible two-species Bose-Einstein condensates in perturbed harmonic traps,"APS Division of Atomic, Molecular and Optical Physics Meeting Abstracts",2013,,G4. 009,2013,
"Rabli, Djamal; Flower, DR; ",The rotational excitation of methanol by molecular hydrogen,Monthly Notices of the Royal Astronomical Society,406,1,95-101,2010,"Blackwell Publishing Ltd Oxford, UK"
"Parker, NG; Proukakis, NP; Barenghi, CF; Adams, CS; ",Controlled vortex-sound interactions in atomic Bose-Einstein condensates,Physical review letters,92,16,160403,2004,APS
"Gardiner, Simon; Felix, Alexandra; ",Juridification of the football field: strategies for giving law the elbow,Marq. Sports LJ,5,,189,1994,HeinOnline
"Carty, D; Le Page, V; Sims, IR; Smith, IWM; ",Low temperature rate coefficients for the reactions of CN and C₂H radicals with allene (CH₂= C= CH₂) and methyl acetylene (CH₃C= CH),Chemical Physics Letters,344,3-4,,2001,Elsevier
"Jones, Matthew; ",Communication fail?,Physics World,29,6,19,2016,IOP Publishing
"Maucher, Fabian; Skupin, Stefan; Gardiner, SA; Hughes, IG; ",Shaping the longitudinal electric field component of light,Complex Light and Optical Forces XIII,10935,,1093502,2019,SPIE
"Raghuram, Adarsh P; Mortlock, Jonathan M; Bromley, Sarah L; Cornish, Simon L; ",A motorized rotation mount for the switching of an optical beam path in under 20 ms using polarization control,Review of Scientific Instruments,94,6,,2023,AIP Publishing
"Saunders, M; Halkyard, PL; Gardiner, SA; Challis, KJ; ",Fractional resonances in the atom-optical δ-kicked accelerator,Physical Review A,79,2,023423,2009,APS
"Flower, DR; Pooley, G; ",Book-Review-Planetary Nebulae-IAU Symposium NO. 103,The observatory.,104,,,1984,The Editors of the Observatory
"Bettles, Robert J; Gardiner, Simon A; Adams, Charles S; ",Cooperative Ordering in Lattices of Interacting Dipoles,,,,,,
"Heck, L; Flower, DR; Des Forêts, G Pineau; ",A computer program for calculating the structure of magnetohydrodynamical shocks in interstellar clouds,Computer physics communications,58,1-2,169-179,1990,Elsevier
"Martin, AD; Adams, CS; Gardiner, SA; ",Bright matter-wave soliton collisions in a harmonic trap: Regular and chaotic dynamics,Physical review letters,98,2,020402,2007,APS
"Potvliege, RM; Zehnlé, V; ",Complex scaling calculation of the decaying quantum-propagation modes of neutral atoms in a magnetic guide,Physical Review A,63,2,025601,2001,APS
"Baker, DJ; Flower, DR; ",Near-resonance vibrational relaxation of 12C16O in collisions with para-H2,Journal of Physics B: Atomic and Molecular Physics,17,19,3901,1984,IOP Publishing
"Jundt, G; Purves, GT; Adams, CS; Hughes, IG; ",Staff profile,,,,,,
"Flower, DR; ",Theoretical predictions of the ultra-violet spectra of planetary nebulae,"Società Astronomica Italiana, Memorie, vol. 47, Sept. 1976, p. 313-335.",47,,313-335,1976,
"Le Bourlot, J; Pineau des Forêts, G; Roueff, E; Flower, DR; ",On the uniqueness of the solutions to the chemical rate equations in interstellar clouds: the gas-dust interface.,"Astronomy and Astrophysics, v. 302, p. 870",302,,870,1995,
"Weatherill, KJ; Pritchard, JD; Abel, RP; Bason, MG; Mohapatra, AK; Adams, CS; ",Electromagnetically induced transparency of a cold Rydberg ensemble.,EuroPhysics news.,39,6,17-17,2008,European Physical Society
"Browaeys, Antoine; Lahaye, Thierry; Porto, Trey; Adams, Charles S; Weidemüller, Matthias; Cugliandolo, Leticia F; ",Current Trends in Atomic Physics,,107,,,2019,Oxford University Press
"Cornish, Simon; Gregory, Philip; Bromley, Sarah; Fernley, Luke; Tao, Li; Kotochigova, Svetlana; ",Development of a rotationally magic trap for ultracold RbCs molecules,"APS Division of Atomic, Molecular and Optical Physics Meeting Abstracts",2022,,H05. 003,2022,
"Billam, TP; Gardiner, SA; ",Quantum resonances in an atom-optical δ-kicked harmonic oscillator,Physical Review A,80,2,023414,2009,APS
"Potvliege, RM; Mese, E; Vučić, Svetlana; ",Multiphoton ionization and multiphoton resonances in the tunneling regime,Physical Review A,81,5,053402,2010,APS
"Flower, DR; Desforets, GP; Roueff, E; Hartquist, TW; ",Observational discrimination between modes of shock propagation in interstellar clouds: Predictions of CH+ and SH+ column densities in diffuse clouds,NASA. Ames Research Center Summer School on Interstellar Processes: Abstracts of Contributed Papers,,,,1986,
"Hutson, Jeremy M; Thornley, Alice E; ",Atom‐spherical top van der Waals complexes: A theoretical study,The Journal of chemical physics,100,4,2505-2521,1994,American Institute of Physics
"Flower, DR; Des Forêts, G Pineau; Walmsley, C Malcolm; ",The abundances of nitrogen-containing molecules during pre-protostellar collapse,Astronomy & Astrophysics,456,1,215-223,2006,EDP Sciences
"Van de Graaff, Michael; Xie, Xin; Chapurin, Roman; Frye, Matthew; Hutson, Jeremy; D'Incao, Jose; Julienne, Paul; Ye, Jun; Cornell, Eric; ",Observation of Universal Efimov's Ratios across an Intermediate-Strength Feshbach Resonance in $^{39}\mathrm {K} $,Bulletin of the American Physical Society,65,,,2020,APS
"Hutson, Jeremy M; Le Seur, Ruth; ","MBF: MOLSCAT 2020, BOUND, and FIELD for atomic and molecular collisions",Astrophysics Source Code Library,,,ascl: 2010.001,2020,
"Pearman, CP; Adams, CS; Cox, SG; Griffin, PF; Smith, DA; Hughes, IG; ",Polarization spectroscopy of a closed atomic transition: applications to laser frequency locking,"Journal of Physics B: Atomic, Molecular and Optical Physics",35,24,5141,2002,IOP Publishing
"Sirunyan, Albert M; Erbacher, Robin; Carvalho, Wagner; Górski, Maciej; Kotlinski, Danek; Ujvari, Balazs; Ozturk, Sertac; Muthumuni, Samila; Polatoz, Ayse; Lander, Richard; ",arXiv: SSearch for gauge-mediated supersymmetry in events with at least one photon and missing transverse momentum in pp collisions at $\sqrt {s}= $13 TeV,Phys. Lett. B,780,CERN-EP-2017-284,118-143,2017,
"Wrathmall, SA; Flower, DR; ",A quantum-mechanical study of rotational transitions in H2 induced by H,"Journal of Physics B: Atomic, Molecular and Optical Physics",39,11,L249,2006,IOP Publishing
"Cvitaš, Marko T; Soldán, Pavel; Hutson, Jeremy M; Honvault, Pascal; Launay, Jean-Michel; ",Interactions and dynamics in Li+ Li2 ultracold collisions,The Journal of chemical physics,127,7,,2007,AIP Publishing
"Green, Dermot G; Vaillant, Christophe L; Frye, Matthew D; Morita, Masato; Hutson, Jeremy M; ",Quantum chaos in ultracold collisions between Yb (1 S 0) and Yb (3 P 2),Physical Review A,93,2,022703,2016,APS
"Roberts, Jacob L; Claussen, Neil R; Cornish, Simon L; Donley, Elizabeth A; Cornell, Eric A; Wieman, Carl E; ",Controlled collapse of a Bose-Einstein condensate,Physical Review Letters,86,19,4211,2001,APS
"Walker, Paul; Krohn, Ulrich; Carty, David; ",ARBTools: A tricubic spline interpolator for three-dimensional scalar or vector fields.,Journal of open research software.,7,1,12,2019,Ubiquity Press
"Adams, CS; ",A mechanical shutter for light using piezoelectric actuators,Review of Scientific Instruments,71,1,59-60,2000,American Institute of Physics
"Sargsyan, A; Tonoyan, A; Keaveney, J; Hughes, IG; Adams, CS; Sarkisyan, D; ",Selective reflection of potassium vapor nanolayers in a magnetic field,Journal of Experimental and Theoretical Physics,126,,293-301,2018,Springer
"Dewangan, DP; Flower, DR; ",Collisional excitation of OH by H2 in the interstellar medium,"Monthly Notices of the Royal Astronomical Society, vol. 199, May 1982, p. 457-463. Research supported by the Science Research Council.",199,,457-463,1982,
"Potvliege, RM; ",Light-induced states of atoms in intense laser fields,Physica Scripta,68,1,C18,2003,IOP Publishing
"Flower, DR; ",Collisional Inversion of the Populations of Λ-Doublets in CH and OH: a Critical Study,Symposium-International Astronomical Union,87,,589-590,1980,Cambridge University Press
"Allwood, DA; Schrefl, T; Hrkac, G; Hughes, IG; Adams, CS; ",Mobile atom traps using magnetic nanowires,Applied physics letters,89,1,,2006,AIP Publishing
"Hopkins, SA; Webster, S; Arlt, J; Bance, P; Cornish, S; Marago, O; Foot, CJ; ",Measurement of elastic cross section for cold cesium collisions,Physical Review A,61,3,032707,2000,APS
"Maucher, F; Skupin, S; Gardiner, SA; Hughes, IG; ",An intuitive approach to structuring the three electric field components of light,New Journal of Physics,21,1,013032,2019,IOP Publishing
"Millen, J; Lochead, G; Corbett, GR; Potvliege, RM; Jones, MPA; ",Publisher's copyright statement: cO 2011 IOP Publishing. Additional information,,,,,2013,
"Flower, DR; ","Collision strengths for electron excitation of highly ionized, complex atoms",Journal of Physics B: Atomic and Molecular Physics,4,5,697,1971,IOP Publishing
"Wallis, Alisdair OG; Gardiner, SA; Hutson, Jeremy M; ",Conical intersections in laboratory coordinates with ultracold molecules,Physical review letters,103,8,083201,2009,APS
"Hutson, Jeremy M; ",A quadrature scheme for matrix elements between numerical wavefunctions,Journal of Computational Physics,56,1,165-172,1984,Elsevier
"Żuchowski, Piotr S; Hutson, Jeremy M; ",Prospects for producing ultracold N H 3 molecules by sympathetic cooling: A survey of interaction potentials,Physical Review A,78,2,022701,2008,APS
"Zentile, Mark A; Andrews, Rebecca; Weller, Lee; Knappe, Svenja; Adams, Charles S; Hughes, Ifan G; ",The hyperfine Paschen–Back Faraday effect,"Journal of Physics B: Atomic, Molecular and Optical Physics",47,7,075005,2014,IOP Publishing
"Gardiner, Simon; Billam, Tom; Helm, John; Holdaway, David; Weiss, Christoph; ",Ideal Classical Solitons as a Limit to a Quantum Many-Body System,"APS Division of Atomic, Molecular and Optical Physics Meeting Abstracts",2013,,M4. 006,2013,
"Sargsyan, Armen; Papoyan, Aram; Hughes, Ifan G; Adams, Charles S; Sarkisyan, David; ",Selective reflection from an Rb layer with a thickness below λ/12 and applications,Optics Letters,42,8,1476-1479,2017,Optica Publishing Group
"Gertjerenken, Bettina; Billam, Thomas P; Blackley, Caroline L; Le Sueur, C Ruth; Khaykovich, Lev; Cornish, Simon L; Weiss, Christoph; ",Generating mesoscopic Bell states via collisions of distinguishable quantum bright solitons,Physical Review Letters,111,10,100406,2013,APS
"Sirunyan, Albert M; Erbacher, Robin; Carrillo Montoya, Camilo Andres; Carvalho, Wagner; Górski, Maciej; Kotlinski, Danek; Ujvari, Balazs; Bein, Samuel; Lander, Richard; Smith, Nicholas; ","Measurement of the top quark mass in the dileptonic $\mathrm {t\bar {t}} $ decay channel using the mass observables $ M_ {\mathrm {b}\ell} $, $ M_ {\mathrm {T} 2} $, and $ M_ {\mathrm {b}\ell\nu} $ in pp collisions at $\sqrt {s}= $8 TeV",Phys. Rev. D,96,CERN-EP-2017-050,032002,2017,
"Janssen, Liesbeth; Żuchowski, Piotr S; van der Avoird, Ad; Hutson, Jeremy M; Groenenboom, Gerrit C; ",Cold and ultracold NH–NH collisions: The field-free case,The Journal of chemical physics,134,12,,2011,AIP Publishing
"Parker, NG; Cornish, SL; Martin, AM; Judd, TE; Scott, RG; Fromhold, TM; Adams, CS; ",Quantum reflection of bright matter-wave solitons,Physica D: Nonlinear Phenomena,,,,2009,Newcastle University
"Sevinçli, S; Ates, C; Pohl, T; Schempp, H; Hofmann, CS; Günter, G; Amthor, T; Weidemüller, M; Pritchard, JD; Maxwell, D; ",Quantum interference in interacting three-level Rydberg gases: coherent population trapping and electromagnetically induced transparency,"Journal of Physics B: Atomic, Molecular and Optical Physics",44,18,184018,2011,IOP Publishing
"Hutson, Jeremy M; Fowler, PW; Zaremba, E; ",Quadrupolar contributions to the atom-surface Van der Waals interaction,Surface Science Letters,175,2,L775-L781,1986,Elsevier
"Hutson, Jeremy M; Clary, DC; Beswick, JA; ",Vibrational predissociation of the Ne–C2H4 and Ar–C2H4 van der Waals complexes,The Journal of chemical physics,81,10,4474-4480,1984,American Institute of Physics
"Haxton, Daniel J; Wrathmall, Steven A; Lewandowski, HJ; Greene, Chris H; ",Theoretical study of the quenching of NH (singlet Delta) molecules via collisions with Rb atoms: preliminary results,arXiv preprint arXiv:0903.3909,,,,2009,
"Wilgenbus, D; Cabrit, S; Pineau des Forets, G; Flower, D; ","Ortho: para-H2 ratio in C and J shocks (Wilgenbus+, 2000)",VizieR Online Data Catalog,335,,,2000,
"Keaveney, James; Wrathmall, Steven A; Adams, Charles S; Hughes, Ifan G; ",Optimized ultra-narrow atomic bandpass filters via magneto-optic rotation in an unconstrained geometry,Optics letters,43,17,4272-4275,2018,Optica Publishing Group
"Takekoshi, Tetsu; Debatin, Markus; Rameshan, Raffael; Ferlaino, Francesca; Grimm, Rudolf; Nägerl, Hanns-Christoph; Le Sueur, C Ruth; Hutson, Jeremy M; Julienne, Paul S; Kotochigova, Svetlana; ","Towards the production of ultracold ground-state RbCs molecules: Feshbach resonances, weakly bound states, and the coupled-channel model",Physical Review A,85,3,032506,2012,APS
"Adams, CS; Riis, E; Ferguson, AI; Rowley, WRC; ",Precision measurement of the 2 ³S--> 3 ³P transition in ⁴He,Physical review. A.,45,,,1992,American Physical Society
"Danby, G; Flower, DR; ",On the S0 (0) and S1 (0) spectra of the H2-H2 dimer,Journal of Physics B: Atomic and Molecular Physics,17,24,L867,1984,IOP Publishing
"Le Bourlot, J; Pineau des Forêts, G; Roueff, E; Flower, DR; ",Atomic carbon in interstellar clouds,AIP Conference Proceedings,312,1,167-172,1994,American Institute of Physics
"Marchant, AL; Händel, S; Hopkins, SA; Wiles, TP; Cornish, SL; ",Bose-Einstein condensation of 85 Rb by direct evaporation in an optical dipole trap,Physical Review A,85,5,053647,2012,APS
"Helm, JL; Rooney, SJ; Weiss, Christoph; Gardiner, SA; ",Splitting bright matter-wave solitons on narrow potential barriers: Quantum to classical transition and applications to interferometry,Physical Review A,89,3,033610,2014,APS
"Halkyard, PL; Saunders, M; Gardiner, SA; Challis, KJ; ","Atomic and molecular processes in external fields, including interactions with strong fields and short pulses-Power-law behavior in the quantum-resonant evolution of the# 948-kicked accelerator","PHYSICAL REVIEW A: atomic, molecular, and optical physics",78,6,63401,2008,
"Zürn, Gerhard; Lompe, Thomas; Wenz, Andre Niklas; Jochim, Selim; Julienne, PS; Hutson, JM; ",Precise characterization of Li 6 Feshbach resonances using trap-sideband-resolved RF spectroscopy of weakly bound molecules,Physical review letters,110,13,135301,2013,APS
"Dubernet, Marie-Lise; Tuckey, Philip A; Hutson, Jeremy M; ",Parity doubling in open-shell van der Waals complexes,Chemical physics letters,193,5,355-363,1992,Elsevier
"Adams, CS; Riis, E; Ferguson, AI; Rowley, WRC; ",Precision measurement of the 2 3 S→ 3 3 P transition in He 4,Physical Review A,45,5,R2667,1992,APS
"Wrathmall, Steven; Meyer, Edmund; Haxton, Daniel; Lewandowski, Heather; Greene, Chris; ",Ultracold collisions between Rb and excited NH,"APS Division of Atomic, Molecular and Optical Physics Meeting Abstracts",39,,OPB. 40,2008,
"Dörr, M; Joachain, CJ; Potvliege, RM; Vučić, S; ",Born-Floquet theory of electron-atom collisions in the presence of a laser field,"Zeitschrift für Physik D Atoms, Molecules and Clusters",29,,245-246,1994,Springer
"Hutson, Jeremy M; ",Feshbach resonances in the presence of inelastic scattering: threshold behavior and suppression of poles in scattering lengths,,,,,2006,
"Marchant, Anna L; Händel, Sylvi; Wiles, Timothy P; Hopkins, Stephen A; Adams, Charles S; Cornish, Simon L; ",Off-resonance laser frequency stabilization using the Faraday effect,Optics letters,36,1,64-66,2011,Optica Publishing Group
"Bettelli, S; Maxwell, D; Fernholz, T; Adams, CS; Lesanovsky, I; Ates, C; ",Exciton dynamics in emergent Rydberg lattices,Physical Review A,88,4,043436,2013,APS
"Wadenpfuhl, Karen; Adams, C Stuart; ",Emergence of synchronisation in a driven-dissipative hot Rydberg vapor,arXiv preprint arXiv:2306.05188,,,,2023,
"Chen, Shuying; Reed, Dominic J; MacKellar, Andrew R; Downes, Lucy A; Almuhawish, Nourah FA; Jamieson, Matthew J; Adams, Charles S; Weatherill, Kevin J; ",Terahertz electrometry via infrared spectroscopy of atomic vapor,Optica,9,5,485-491,2022,Optica Publishing Group
"Chai, S; Fekete, J; Gardiner, SA; Andersen, MF; ",Resonant transfer of large momenta from finite-duration kicks,2017 Conference on Lasers and Electro-Optics Pacific Rim (CLEO-PR),,,1-3,2017,IEEE
"Cornish, Simon; Gregory, Phillip; Blackmore, Jacob; Bromley, Sarah; ",Observation of photoinduced two-body loss of ultracold RbCs molecules,"APS Division of Atomic, Molecular and Optical Physics Meeting Abstracts",2020,,T06. 002,2020,
"Adams, CS; Ferguson, AI; ",Tunable narrow linewidth ultra-violet light generation by frequency doubling of a ring Ti: sapphire laser using lithium tri-borate in an external enhancement cavity,Optics communications,90,1-3,89-94,1992,Elsevier
"Flower, DR; Mayer, P; ",Book-Review-Planetary Nebulae-IAU SYMP. 103,Bulletin of the Astronomical Institutes of Czechoslovakia,35,,,1984,
"Jackson, B; McCann, JF; Adams, CS; ",Flow of a weakly-interacting Bose condensate,"Technical Digest. Summaries of Papers Presented at the International Quantum Electronics Conference. Conference Edition. 1998 Technical Digest Series, Vol. 7 (IEEE Cat. No. 98CH36236)",,,48-49,1998,IEEE
"Adams, CS; Riis, E; Ferguson, AI; Rowley, W RC; ",Precision measurement of the 2 sup 3 S r arrow 3 sup 3 P transition in sup 4 He,Physical Review A. General Physics;(United States),45,5,,1992,
"Harris, ML; Tierney, P; Cornish, SL; ",Towards a quantum degenerate^ 1^ 3^ 3Cs-^ 8^ 7Rb mixture,EUROPHYSICS CONFERENCE ABSTRACTS ECA,30,D,160,2006,EUROPEAN PHYSICAL SOCIETY
"Blackmore, Jacob A; Caldwell, Luke; Gregory, Philip D; Bridge, Elizabeth M; Sawant, Rahul; Aldegunde, Jesús; Mur-Petit, Jordi; Jaksch, Dieter; Hutson, Jeremy M; Sauer, BE; ",Ultracold molecules for quantum simulation: rotational coherences in CaF and RbCs,Quantum Science and Technology,4,1,014010,2018,IOP Publishing
"Flower, DR; Pineau des Forets, G; ",Multicomponent reacting MHD flows–a reply,Monthly Notices of the Royal Astronomical Society,220,1,149-153,1986,"Oxford University Press Oxford, UK"
"Parker, NG; Martin, AM; Adams, CS; Cornish, SL; ",Bright solitary waves of trapped atomic Bose–Einstein condensates,Physica D: Nonlinear Phenomena,238,15,1456-1461,2009,Elsevier
"Flower, DR; ",On the interpretation of the relative intensities of the solar XUV lines of lithium-like ions,International Astronomical Union Colloquium,14,,738-739,1972,Cambridge University Press
"des Forêts, G Pineau; Flower, DR; Hartquist, TW; Dalgarno, A; ",Theoretical studies of interstellar molecular shocks-III. The formation of CH+ in diffuse clouds,Monthly Notices of the Royal Astronomical Society,220,4,801-824,1986,Oxford University Press (OUP)
"Claussen, NR; Cornell, EA; Cornish, SL; Donley, EA; Roberts, JL; ",Controlled Collapse of a Bose-Einstein Condensate,Physical Review Letters,86,19,,2003,
"Lloyd, GM; Kaminski, CF; Hughes, IG; Ewart, P; ",Multiplex Degenerate Four Wave Mixing Thermometry of the C2 Radical,Laser Applications to Chemical and Environmental Analysis,,,LThC. 2,1996,Optica Publishing Group
"Roberts, JL; Claussen, NR; Cornish, SL; Wieman, CE; ",Magnetic Field Dependence of Inelastic Collisions Near a Feshbach Resonance,"APS Division of Atomic, Molecular and Optical Physics Meeting Abstracts",14,,B2. 03,2000,
"Pfau, Tilman; Kurtsiefer, Ch; Adams, Charles S; Sigel, Martin; Mlynek, Jürgen; ",Magneto-optical beam splitter for atoms,Physical review letters,71,21,3427,1993,APS
"Heiner, CE; Carty, D; Meijer, G; Bethlem, HL; Crompvoets, FMH; ",An electrostatic storage ring for neutral molecules,Verhandlungen der Deutschen Physikalischen Gesellschaft,40,3,69,2005,
"Maucher, F; Skupin, Stefan; Gardiner, SA; Hughes, IG; ",Creating complex optical longitudinal polarization structures,Physical Review Letters,120,16,163903,2018,APS
"Potvliege, RM; ",STURMIAN-FLOQUET CALCULATIONS IN HYDROGEN,Super-Intense Laser-Atom Physics IV,13,,133,1996,Springer Science & Business Media
"Jurgilas, S; Chakraborty, A; Rich, CJH; Sauer, BE; Frye, Matthew D; Hutson, Jeremy M; Tarbutt, MR; ",Collisions in a dual-species magneto-optical trap of molecules and atoms,New Journal of Physics,23,7,075004,2021,IOP Publishing
"Claussen, NR; Cornish, SL; Roberts, JL; Cornell, EA; Wieman, CE; Arimondo, E; DeNatale, P; Inguscio, M; ",Rb-85 BEC near a Feshbach resonance,,,,,2001,
"Dubernet, Marie‐Lise; Hutson, Jeremy M; ",Atom–molecule van der Waals complexes containing open‐shell atoms. I. General theory and bending levels,The Journal of chemical physics,101,3,1939-1958,1994,American Institute of Physics
"Jacobs, VL; Burke, PG; Potvliege, RM; ",Liouville-space R-matrix-Floquet description of atomic radiative processes involving autoionizing states in the presence of intense electromagnetic fields,"Journal of physics B: atomic, molecular and optical physics",47,2,025401,2014,IOP Publishing
"Wade, Christopher G; Šibalić, Nikola; de Melo, Natalia R; Kondo, Jorge M; Adams, Charles S; Weatherill, Kevin J; ",Real-time near-field terahertz imaging with atomic optical fluorescence,Nature Photonics,11,1,40-43,2017,Nature Publishing Group UK London
"Parker, NG; Adams, CS; ",Response of an atomic Bose–Einstein condensate to a rotating elliptical trap,"Journal of Physics B: Atomic, Molecular and Optical Physics",39,1,43,2005,IOP Publishing
"Green, Sheldon; Hutson, Jeremy; ",Spectral line shape parameters for HF in a bath of Ar are accurately predicted by a potential inferred from spectra of the van der Waals dimer,The Journal of chemical physics,100,2,891-898,1994,American Institute of Physics
