Authors,Title,Publication,Volume,Number,Pages,Year,Publisher
"Brooks, RV; Spence, S; Guttridge, A; Alampounti, A; Rakonjac, A; McArd, LA; Hutson, Jeremy M; Cornish, Simon L; ",Preparation of one 87Rb and one 133Cs atom in a single optical tweezer,New Journal of Physics,23,6,065002,2021,IOP Publishing
"Flower, DR; Guilloteau, S; ",Pumping of H II/OH masers-IR line overlaps and collisional excitation by H2,"Astronomy and Astrophysics, vol. 114, no. 2, Oct. 1982, p. 238-244. Research supported by the Science Research Council and Universite de Grenoble.",114,,238-244,1982,
"Carr, Christopher; Ritter, Ralf; Wade, CG; Adams, Charles S; Weatherill, Kevin J; ",Nonequilibrium phase transition in a dilute Rydberg ensemble,Physical review letters,111,11,113901,2013,APS
"Truppe, Stefan; Fitch, Noah; Williams, Hannah; Hambach, Moritz; Sauer, Ben; Hinds, Ed; Tarbutt, Mike; ",Slowing techniques for loading a magneto-optical trap of CaF molecules,"APS Division of Atomic, Molecular and Optical Physics Meeting Abstracts",2016,,Q1. 154,2016,
"Frye, Matthew D; Hutson, Jeremy M; ",Characterizing Feshbach resonances in ultracold scattering calculations,Physical Review A,96,4,042705,2017,APS
"Rotunno, Andrew P; Berweger, Samuel; Prajapati, Nikunjkumar; Simons, Matthew T; Artusio-Glimpse, Alexandra B; Holloway, Christopher L; Jayaseelan, Maitreyi; Potvliege, RM; Adams, CS; ",Detection of 3–300 MHz electric fields using Floquet sideband gaps by “Rabi matching” dressed Rydberg atoms,Journal of Applied Physics,134,13,,2023,AIP Publishing
"Lara, Manuel; Bohn, John L; Potter, Daniel; Soldán, Pavel; Hutson, Jeremy M; ",Ultracold Rb-OH collisions and prospects for sympathetic cooling,Physical review letters,97,18,183201,2006,APS
"Joachain, CJ; Potvliege, RM; ",Importance of absorption effects on fast positron-argon differential cross sections,Physical Review A,35,11,4873,1987,APS
"Peyrot, T; Sortais, Yvan RP; Greffet, J-J; Browaeys, A; Sargsyan, A; Keaveney, J; Hughes, IG; Adams, CS; ",Optical transmission of an atomic vapor in the mesoscopic regime,Physical Review Letters,122,11,113401,2019,APS
"Blackley, Caroline L; Le Sueur, C Ruth; Hutson, Jeremy M; McCarron, Daniel J; Köppinger, Michael P; Cho, Hung-Wen; Jenkin, Daniel L; Cornish, Simon L; ",Feshbach resonances in ultracold 85 Rb,Physical Review A,87,3,033611,2013,APS
"Adam, Wolfgang; Bergauer, T; Blöch, D; Dragicevic, M; Frühwirth, R; Hinger, V; Steininger, H; Beaumont, W; Di Croce, D; Janssen, X; ",The CMS Phase-1 pixel detector upgrade,Journal of instrumentation,16,02,P02027,2021,IOP Publishing
"Flower, DR; Launay, J-M; ",Excitation of the fine-structure transition of C+ in collisions with molecular hydrogen,Journal of Physics B: Atomic and Molecular Physics,10,6,L229,1977,IOP Publishing
"Weidmann, Damien; Hirst, Bill; Jones, Matthew; Ijzermans, Rutger; Randell, David; Macleod, Neil; Kannath, Arun; Chu, Johnny; Dean, Marcella; ",Locating and Quantifying Methane Emissions by Inverse Analysis of Path-Integrated Concentration Data Using a Markov-Chain Monte Carlo Approach,ACS Earth and Space Chemistry,6,9,2190-2198,2022,ACS Publications
"Marchant, AL; Billam, TP; Yu, MMH; Rakonjac, A; Helm, JL; Polo, J; Weiss, C; Gardiner, SA; Cornish, SL; ",Quantum reflection of bright solitary matter waves from a narrow attractive potential,Physical Review A,93,2,021604,2016,APS
"Mukherjee, R; Millen, J; Nath, R; Jones, MPA; Pohl, T; ",Many-body physics with alkaline-earth Rydberg lattices,"Journal of Physics B: Atomic, Molecular and Optical Physics",44,18,184010,2011,IOP Publishing
"Shingal, R; Noble, CJ; Bransden, BH; Flower, DR; ",Semiclassical calculations of charge exchange and excitation in Na+-Li and Li+-Na collisions using atomic-orbital expansions,Journal of Physics B: Atomic and Molecular Physics,19,23,3951,1986,IOP Publishing
"Shchedrin, Gavriil; Jaschke, Daniel; Han, Wei; Carr, Lincoln; Green, Dermot G; Aldegunde, Jesus; Hutson, Jeremy M; ",Many-body physics of ultracold doublet sigma molecules in optical lattices,APS March Meeting Abstracts,2016,,V50. 015,2016,
"Franzen, Tobias; Guttridge, Alexander; Wilson, Kali E; Segal, Jack; Frye, Matthew D; Hutson, Jeremy M; Cornish, Simon L; ",Observation of magnetic Feshbach resonances between Cs and Yb 173,Physical Review Research,4,4,043072,2022,APS
"Sirunyan, Albert M; Tumasyan, Armen; Adam, Wolfgang; Ambrogi, Federico; Asilar, Ece; Bergauer, Thomas; Brandstetter, Johannes; Brondolin, Erica; Dragicevic, Marko; Erö, Janos; ",Precision measurement of the structure of the CMS inner tracking system using nuclear interactions,Journal of instrumentation,13,,,2018,IOP Publishing Ltd
"Pellizzari, Thomas; Gardiner, Simon A; Cirac, Juan Ignacio; Zoller, Peter; ","Decoherence, continuous observation, and quantum computing: A cavity QED model",Physical Review Letters,75,21,3788,1995,APS
"Arnold, Aidan S; Pritchard, Matthew J; Smith, David A; Hughes, Ifan G; ",Double-impulse magnetic focusing of launched cold atoms,New Journal of Physics,8,4,53,2006,IOP Publishing
"Cvitaš, Marko T; Soldán, Pavel; Hutson, Jeremy M; ",Long range intermolecular forces in triatomic systems: Connecting the atom–diatom and atom–atom–atom representations,Molecular Physics,104,1,23-31,2006,Taylor & Francis
"Maret, S; Ceccarelli, C; Tielens, AGGM; Caux, E; Lefloch, B; Faure, A; Castets, Alain; Flower, DR; ",CHOH abundance in low mass protostars,Astronomy & Astrophysics,442,2,527-538,2005,EDP Sciences
"Gonzalez-Martinez, Maykel L; Hutson, Jeremy M; ",Effect of hyperfine interactions on ultracold molecular collisions: NH (3 Σ−) with Mg (1 S) in magnetic fields,Physical Review A,84,5,052706,2011,APS
"Hutson, Jeremy; ",Prospects of forming molecules with both electric and magnetic dipoles: magnetoassociation between alkali-metal atoms and closed-shell atoms,New Science with Ultracold Molecules,,,23,2013,
"Abel, Richard P; Krohn, Ulrich; Siddons, Paul; Hughes, Ifan G; Adams, Charles S; ",Faraday dichroic beam splitter for Raman light using an isotopically pure alkali-metal-vapor cell,Optics letters,34,20,3071-3073,2009,Optica Publishing Group
"Keaveney, James; Rimmer, Dennis A; Hughes, Ifan G; ",Self-similarity of optical rotation trajectories around the Poincare sphere with application to an ultra-narrow atomic bandpass filter,arXiv preprint arXiv:1807.04652,,,,2018,
"Weiss, Christoph; Gardiner, Simon A; Gertjerenken, Bettina; ",Temperatures are not useful to characterise bright-soliton experiments for ultra-cold atoms,arXiv preprint arXiv:1610.09074,,,,2016,
"Wang, Kenneth; Yu, Yichao; Hood, Jonathan; Picard, Lewis; Zhang, Jessie; Cairncross, William; Hutson, Jeremy; Gonzalez-Ferez, Rosario; Rosenband, Till; Ni, Kang-Kuen; ",Coherent optical creation of a single molecule in an optical tweezer,Bulletin of the American Physical Society,66,,,2021,APS
"Potvliege, RM; Kylstra, Niels Jan; Joachain, CJ; ",Photon emission by He+ in intense ultrashort laser pulses,"Journal of Physics B: Atomic, Molecular and Optical Physics",33,20,L743,2000,IOP Publishing
"Hutson, Jeremy M; ",The intermolecular potential of Ne–HCl: Determination from high‐resolution spectroscopy,The Journal of chemical physics,91,8,4448-4454,1989,American Institute of Physics
"Bounds, AD; Jackson, NC; Hanley, RK; Bridge, EM; Huillery, P; Jones, MPA; ",Coulomb anti-blockade in a Rydberg gas,New Journal of Physics,21,5,053026,2019,IOP Publishing
"Bach, R; Burnett, K; d'Arcy, MB; Gardiner, SA; ","Publisher's Note: Quantum-mechanical cumulant dynamics near stable periodic orbits in phase space: Application to the classical-like dynamics of quantum accelerator modes [Phys. Rev. A 71, 033417 (2005)]",Physical Review A,71,4,049902,2005,APS
"Fowler, PW; Hutson, Jeremy M; ",Pairwise-additive models for atom-surface interaction potentials: An ab initio study of He-LiF,Physical Review B,33,6,3724,1986,APS
"Maxwell, D; Szwer, DJ; Paredes-Barato, D; Busche, H; Pritchard, JD; Gauguet, Alexandre; Jones, MPA; Adams, CS; ",Microwave control of the interaction between two optical photons,Physical Review A,89,4,043827,2014,APS
"Carrington, Alan; Gammie, David I; Page, Josephine C; Shaw, Andrew M; Hutson, Jeremy M; ",Microwave electronic spectrum of the Ne⋯ Ne+ long-range complex: The interaction potential,The Journal of chemical physics,116,9,3662-3669,2002,American Institute of Physics
"Maxwell, James L; Hughes, Ifan G; Adams, Charles S; ",White-light versus discrete wavelength measurements of Faraday dispersion and the Verdet constant,European Journal of Physics,43,1,015302,2021,IOP Publishing
"Kochanski, E; Flower, DR; ",AB initio calculations of the OH H2 potential energy surface,Chemical Physics,57,1-2,217-225,1981,Elsevier
"FLOWER, DR; LAUNAY, JM; ROUEFF, E; ",16.–THE ROLE OF FINE STRUCTURE TRANSITIONS,"Les spectres des molécules simples au laboratoire et en astrophysique: communications présentées au XXIe Colloque international d'astrophysique, tenu à Liège les 21, 22 et 23 juin 1977",,,137,1980,"Université de Liège, Institut d'astrophysique"
"Keaveney, James; Hughes, Ifan G; Sargsyan, A; Sarkisyan, D; Adams, CS; ",Maximal refraction and superluminal propagation in a gaseous nanolayer,Physical review letters,109,23,233001,2012,APS
"Brookes, Samuel GH; Hutson, Jeremy M; ",Interaction potential for NaCs for ultracold scattering and spectroscopy,The Journal of Physical Chemistry A,126,25,3987-4001,2022,ACS Publications
"Adam, Wolfgang; Bergauer, T; Brondolin, E; Dragicevic, M; Friedl, M; Frühwirth, R; Hoch, M; Hrubec, J; König, A; Steininger, H; ",P-type silicon strip sensors for the new CMS tracker at HL-LHC,Journal of instrumentation,12,06,P06018,2017,IOP Publishing
"Hutson, JM; Green, S; ",MOLSCAT computer code,Collaborative Computational Project,,6,,1994,
"Downes, Lucy A; MacKellar, Andrew R; Whiting, Daniel J; Bourgenot, Cyril; Adams, Charles S; Weatherill, Kevin J; ",Ultra-high-speed terahertz imaging using atomic vapour,arXiv preprint arXiv:1903.01308,,,,2019,
"Smith, David A; Hughes, Ifan G; ",The role of hyperfine pumping in multilevel systems exhibiting saturated absorption,American Journal of Physics,72,5,631-637,2004,American Association of Physics Teachers
"Jaquet, R; Staemmler, V; Smith, MD; Flower, DR; ",Excitation of the fine-structure transitions of O (3PJ) in collisions with ortho-and para-H2,"Journal of Physics B: Atomic, Molecular and Optical Physics",25,1,285,1992,IOP Publishing
"Ribeiro, Sofia; Cutler, Thomas F; Adams, Charles S; Gardiner, Simon A; ",Collective effects in the photon statistics of thermal atomic ensembles,Physical Review A,104,1,013719,2021,APS
"Whittaker, Kate A; Keaveney, James; Hughes, Ifan G; Adams, Charles S; ","Hilbert transform: Applications to atomic spectra (vol 91, 032513, 2015)",PHYSICAL REVIEW A,92,5,,2015,"AMER PHYSICAL SOC ONE PHYSICS ELLIPSE, COLLEGE PK, MD 20740-3844 USA"
"Flower, DR; Gathier, R; ",Book-Review-Planetary Nebulae,"Space Science Reviews, Vol. 37, Issue 3, p. 401, 1984",37,,401,1984,
"Albus, Alexander P; Gardiner, Simon A; Illuminati, Fabrizio; Wilkens, Martin; ",Quantum field theory of dilute homogeneous Bose-Fermi mixtures at zero temperature: General formalism and beyond mean-field corrections,Physical Review A,65,5,053607,2002,APS
"Vaillant, CL; Potvliege, RM; Jones, MPA; ",Intercombination effects in resonant energy transfer,Physical Review A,92,4,042705,2015,APS
"Flower, DR; ",Review of atomic physics as applied to the diffuse interstellar medium.,Diffuse Matter in Galaxies: Cargèse 1982,,,239-257,1983,Springer
"Rotunno, Andrew P; Berweger, Samuel; Prajapati, Nikunjkumar; Simons, Matthew T; Artusio-Glimpse, Alexandra B; Holloway, Christopher L; Potvliege, Robert M; Adams, CS; ",Pseudo-resonant Detection of'Low Frequency'VHF Electric Fields via Rabi Matching with Autler-Townes Splitting in Rydberg Atoms,arXiv preprint arXiv:2212.03304,,,,2022,
"Weatherill, KJ; Pritchard, JD; Able, RP; Bason, MG; Mohapatra, AK; Adams, CS; ",Light interactions in Rydberg ensembles,European Quantum Electronics Conference,,,EF_P13,2009,Optica Publishing Group
"Jenkin, DL; McCarron, DJ; Köppinger, MP; Cho, HW; Hopkins, SA; Cornish, SL; ",Bose-Einstein condensation of 87 Rb in a levitated crossed dipole trap,The European Physical Journal D,65,,11-18,2011,Springer
"Soldán, Pavel; Cvitaš, Marko T; Hutson, Jeremy M; Honvault, Pascal; Launay, Jean-Michel; ",Quantum Dynamics of Ultracold N a+ N a 2 Collisions,Physical review letters,89,15,153201,2002,APS
"Adams, CS; Maker, GT; Ferguson, AI; ",FM operation of Nd: YAG lasers with standing wave and ring cavity configurations,Optics communications,76,2,127-130,1990,Elsevier
"Hinds, EA; Barton, PA; Boshier, MG; Hughes, IG; ",Atoms on mirrors and trampolines,,,,,1997,
"Tumasyan, Armen; Erbacher, Robin; Carrillo Montoya, Camilo Andres; Newbold, Dave M; Carvalho, Wagner; Górski, Maciej; Sommerhalder, Manuel; Lindsey, Cole; Ujvari, Balazs; Muthumuni, Samila; ",Two-particle Bose-Einstein correlations and their Levy parameters in PbPb collisions at $\sqrt {\smash [b]{s_ {_ {\mathrm {NN}}}}}= $5.02 TeV,,,,,2023,
"Hirst, Bill; Randell, David; Jones, Matthew; Chu, Johnny; Kannath, Arun; Macleod, Neil; Dean, Marcella; Weidmann, Damien; ",Methane emissions: Remote mapping and source quantification using an open‐path laser dispersion spectrometer,Geophysical Research Letters,47,10,e2019GL086725,2020,Wiley Online Library
"Bettles, Robert J; Gardiner, Simon A; Adams, Charles S; ",Enhanced optical cross section via collective coupling of atomic dipoles in a 2D array,Physical review letters,116,10,103602,2016,APS
"May, Paul W; Pineau des Forêts, G; Flower, David R; Field, D; Allan, NL; Purton, John A; ",Sputtering of grains in C-type shocks,Monthly Notices of the Royal Astronomical Society,318,3,809-816,2000,"Blackwell Science Ltd Oxford, UK"
"Dewangan, DP; Flower, DR; ",Collisional excitation of OH by H/sub 2/in the interstellar medium,Mon. Not. R. Astron. Soc.;(United Kingdom),199,2,,1982,
"Potvliege, RM; Shakeshaft, R; ",High-order harmonic generation and Raman scattering by hydrogen in perturbation theory,"Zeitschrift fuer Physik, D",11,1,93-94,1989,
"Truppe, S; Williams, H; Fitch, HHN; Wall, TE; Hinds, EA; Sauer, BE; Tarbutt, MR; ","A bright, cold, velocity-controlled molecular beam by frequency-chirped laser slowing",arXiv preprint arXiv:1605.06055,,,,2016,
"Meuwly, Markus; Hutson, Jeremy M; ",Potential energy surfaces and properties of the Br–HBr complex,Physical Chemistry Chemical Physics,2,4,441-446,2000,Royal Society of Chemistry
"Chen, Shuying; Reed, Dominic; Downes, Lucy A; MacKellar, Andrew R; Almuhawish, Nourah F; Jamieson, Matthew J; Adams, Charles S; Weatherill, Kevin J; ",THz electrometry with Rydberg atoms and all IR lasers,"2021 46th International Conference on Infrared, Millimeter and Terahertz Waves (IRMMW-THz)",,,1-2,2021,IEEE
"Flower, David R; Forêts, G Pineau des; ",Grain-mantle erosion in magnetohydrodynamic shocks,Monthly Notices of the Royal Astronomical Society,268,3,724-732,1994,"Oxford University Press Oxford, UK"
"Wrathmall, SA; Gusdorf, A; Flower, DR; ",The excitation of molecular hydrogen by atomic hydrogen in astrophysical media,Monthly Notices of the Royal Astronomical Society,382,1,133-138,2007,"Blackwell Publishing Ltd Oxford, UK"
"Adams, Charles; ",Vortices multiply in superfluid helium-II,Physics World,14,2,21,2001,IOP Publishing
"Cohen, M; Flower, DR; Goharji, A; ",Physical Conditions in the Compact Planetary Nebula Sw St 1,Symposium-International Astronomical Union,103,,520-520,1983,Cambridge University Press
"Dewangan, DP; Flower, DR; Danby, G; ",Rotational excitation of OH by H2: a comparison between theory and experiment,Journal of Physics B: Atomic and Molecular Physics,19,21,L747,1986,IOP Publishing
"Eardley, Jack S; Warner, Neil; Deng, LZ; Carty, David; Wrede, Eckart; ",Magnetic trapping of SH radicals,Physical Chemistry Chemical Physics,19,12,8423-8427,2017,Royal Society of Chemistry
"Frye, Matthew D; Hutson, Jeremy M; ",Complexes formed in collisions between ultracold alkali-metal diatomic molecules and atoms,New Journal of Physics,23,12,125008,2021,IOP Publishing
"Flower, D; Pineau des Forêts, G; ",The Influence of Grains on the Propagation and Structure of C-Type Shock Waves in Interstellar Molecular Clouds,"The Dense Interstellar Medium in Galaxies: Proceedings of the 4th Cologne-Bonn-Zermatt-Symposium “The Dense Interstellar Medium in Galaxies”, Zermatt, 22–26 September, 2003",,,435-438,2004,Springer
"Meṣe, E; Potvliege, RM; ",Quasienergy spectrum of complex atoms,Physical Review A,77,2,023414,2008,APS
"Siddons, Paul; Weller, Lee; Adams, Charles S; Hughes, Ifan G; ",Optical control of the Faraday Effect in a Slow-light Medium,Slow and Fast Light,,,SLMB3,2011,Optica Publishing Group
"Jones, Matthew PA; Marcassa, Luis Gustavo; Shaffer, James; ",Special issue on cold Rydberg atoms,"Journal of Physics B: Atomic, Molecular and Optical Physics",48,18,180201,2015,IOP Publishing
"Jochim, S; Zürn, G; Wenz, AN; Lompe, T; Julienne, PS; Hutson, JM; ",Resolved-sideband RF spectroscopy on weakly bound^ 6Li 2 molecules,"APS Division of Atomic, Molecular and Optical Physics Meeting Abstracts",43,,B5. 006,2012,
"Flower, DR; ",Chemical Process in the Shocked Interseller Gas: Discussion,""" Philosophical Transactions A: Mathematical, Physical and Engineering Sciences""",303,,,1981,The Royal Society
"Softley, Timothy; Bell, Martin; Carty, David; Gingell, Alexander; Oldham, James; ",Towards the study of ultracold ion-molecule reactions,Verhandlungen der Deutschen Physikalischen Gesellschaft,42,,,2007,
"Slim, HA; Heck, EL; Bransden, BH; Flower, DR; ",Theoretical differential cross sections for proton-helium scattering at intermediate energies,"Journal of Physics B: Atomic, Molecular and Optical Physics",24,9,2353,1991,IOP Publishing
"Helm, JL; Cornish, SL; Gardiner, SA; ",Sagnac interferometry using bright matter-wave solitons,Physical review letters,114,13,134101,2015,APS
"Staemmler, V; Flower, DR; ",Excitation of the C (2p2. 3Pj) fine structure states in collisions with He (1s2 1S0),"Journal of Physics B: Atomic, Molecular and Optical Physics",24,9,2343,1991,IOP Publishing
"Cirac, I; Zoller, P; Pellizzari, T; Gardiner, SA; Cirac, JI; Zoller, P; Monroe, C; Meekhof, DM; King, BE; Itano, WM; ",Demonstration of a fundamental quantum logic gate,Phys. Rev. Lett,75,,4714,1995,
"Cvitaš, Marko T; Soldán, Pavel; Hutson, Jeremy M; Honvault, Pascal; Launay, Jean-Michel; ",Ultracold collisions involving heteronuclear alkali metal dimers,Physical review letters,94,20,200402,2005,APS
"Le Bourlot, J; Pineau des Forêts, G; Flower, DR; ",The cooling of astrophysical media by H2,Monthly Notices of the Royal Astronomical Society,305,4,802-810,1999,The Royal Astronomical Society
"Flower, DR; Goharji, A; Cohen, M; ",Ultraviolet spectra of planetary nebulae–X. Physical conditions in the compact planetary nebula Sw St 1,Monthly Notices of the Royal Astronomical Society,206,2,293-304,1984,The Royal Astronomical Society
"Hutson, Jeremy M; ",Centrifugal distortion constants for diatomic molecules: an improved computational method,Journal of Physics B: Atomic and Molecular Physics,14,5,851,1981,IOP Publishing
"Gregory, Philip D; Blackmore, Jacob A; Fernley, Luke M; Bromley, Sarah L; Hutson, Jeremy M; Cornish, Simon L; ",Molecule–molecule and atom–molecule collisions with ultracold RbCs molecules,New Journal of Physics,23,12,125004,2021,IOP Publishing
"Hutson, Jeremy M; Liu, Suyan; Moskowitz, Jules W; Bacic, Zlatko; ","Gas Phase Dynamics and Structure: Spectroscopy, Molecular Interactions, Scattering, and Photochemistry-Nonadditive intermolecular forces in Arn-HF van der Waals clusters: Effects on the HF",Journal of Chemical Physics,111,18,8378-8383,1999,"[New York, etc.]: American Institute of Physics."
"Jackson, B; McCann, JF; Adams, CS; ",Vortex rings and mutual drag in trapped Bose-Einstein condensates,Physical Review A,60,6,4882,1999,APS
"Potvliege, RM; Joachain, CJ; ",Coherent electron impact excitation of the n= 2 states of atomic hydrogen at intermediate energies,Journal of Physics B: Atomic and Molecular Physics,18,16,L585,1985,IOP Publishing
"Mckellar, ARW; Johns, JWC; Hutson, JM; ","Rare Gas-Hydrogen Chloride Complexes: Far Infrared Observations of Ar-HCl and Xe-HCl, and Calculations of Excited States for Xe-HCl",Dynamics of Polyatomic Van der Waals Complexes,,,449-460,1990,Springer
"Mathew, Renju S; O’Donnell, Roshan; Pizzey, Danielle; Hughes, Ifan G; ",The Raspberry Pi auto-aligner: Machine learning for automated alignment of laser beams,Review of Scientific Instruments,92,1,,2021,AIP Publishing
"Flower, D; ",MOLECULAR COLLISIONS IN THE INTERSTELLAR MEDIUM Second Edition,CAMBRIDGE ASTROPHYSICS SERIES,42,1,ALL-ALL,2007,Cambridge University Press
"Tokunaga, Sean K; Skomorowski, Wojciech; Żuchowski, Piotr S; Moszynski, Robert; Hutson, Jeremy M; Hinds, EA; Tarbutt, MR; ","Prospects for sympathetic cooling of molecules in electrostatic, ac and microwave traps",The European Physical Journal D,65,,141-149,2011,Springer
"Soldán, Pavel; Cvitaš, Marko T; Hutson, Jeremy M; ",Three-body nonadditive forces between spin-polarized alkali-metal atoms,Physical Review A,67,5,054702,2003,APS
"Quemener, Goulven; Honvault, Pascal; Launay, Jean-Michel; Soldan, Pavel; Potter, Daniel E; Hutson, Jeremy M; ",Atomic and molecular collisions and interactions-Ultracold quantum dynamics: Spin-polarized K+ K2 collisions with three identical bosons or fermions,Physical Review-Section A-Atomic Molecular and Optical Physics,71,3,32722-32722,2005,"New York, NY: Published by the American Physical Society through the …"
"Croft, James FE; Hutson, Jeremy M; Julienne, Paul S; ",Optimized multichannel quantum defect theory for cold molecular collisions,Physical Review A,86,2,022711,2012,APS
"Ma, Zhao-Yuan; d'Arcy, Michael; Gardiner, Simon; Burnett, Keith; Summy, Gil; Guarneri, Italo; Rebuzzini, Laura; Fishman, Shmuel; ",Gravity-sensitive dynamics and quantum chaos,APS March Meeting Abstracts,2004,,J22. 011,2004,
"Dragicevic, M; Friedl, M; Hrubec, J; Steininger, H; Gädda, A; Härkönen, J; Lampén, T; Luukka, P; Peltola, T; Tuominen, E; ",Test beam performance measurements for the Phase I upgrade of the CMS pixel detector,Journal of Instrumentation,12,05,P05022,2017,IOP Publishing
"Adams, CS; Cox, SG; Riis, E; Arnold, AS; Adamson, SO; Dement’ev, AI; Maleev, VV; ",Acquaviva S and De Giorgi ML: Fast photography of XeCl laser-induced plasma of graphite in vacuum and in nitrogen atmosphere 247 Adachi J: see Hosaka K 4617,J. Phys. B: At. Mol. Opt. Phys,36,,4913-4938,2003,
"Ticknor, C; Parker, NG; Melatos, A; Cornish, SL; O’Dell, DHJ; Martin, AM; ",Collapse times of dipolar Bose-Einstein condensates,Physical Review A,78,6,061607,2008,APS
"Guttridge, Alexander; Hopkins, Stephen A; Frye, Matthew D; McFerran, John J; Hutson, Jeremy M; Cornish, Simon L; ",Production of ultracold Cs* Yb molecules by photoassociation,Physical Review A,97,6,063414,2018,APS
"Carty, David; ",Collisional processes of astrochemical importance at very low temperatures,,,,,2003,University of Birmingham
"Bromley, Sarah; Innes, Andrew; Matthies, Jonas; McArd, Lewis; Mortlock, Jonathan; Ratkata, Apichayaporn; Cornish, Simon; ",Towards a quantum gas microscope for molecules,"APS Division of Atomic, Molecular and Optical Physics Meeting Abstracts",2020,,K01. 171,2020,
"Jiang, H; Hutson, J; Bacic, Z; ",Size and isomer dependence of HF vibrational frequency shifts in ArnHF clusters from diffusion Monte Carlo calculations on nonadditive potential energy surfaces.,ABSTRACTS OF PAPERS OF THE AMERICAN CHEMICAL SOCIETY,226,,U313-U313,2003,"AMER CHEMICAL SOC 1155 16TH ST, NW, WASHINGTON, DC 20036 USA"
"Flower, DR; Pineau des Forêts, G; ",Thermal and chemical evolution of interstellar clouds: Erratum,Monthly Notices of the Royal Astronomical Society,249,,191-787,1991,
"Peyrot, Tom; Keaveney, James; van RP Sortais, Y; Sargsyan, Armen; Hughes, IG; Greffet, JJ; Adams, CS; Browaeys, Antoine; ",Atomic vapor confined in a nanoscale geometry: from mesoscopic to collective effects.,European Quantum Electronics Conference,,,ea_2_5,2019,Optica Publishing Group
"Atkins, Keith M; Hutson, Jeremy M; ",A classical trajectory study of Ar+ Ar2 collisions: Phase space structures in three degrees of freedom,The Journal of chemical physics,103,21,9218-9227,1995,American Institute of Physics
"Siddons, Paul; Adams, Charles S; Ge, Chang; Hughes, Ifan G; ",Absolute absorption on rubidium D lines: comparison between theory and experiment,"Journal of Physics B: Atomic, Molecular and Optical Physics",41,15,155004,2008,IOP Publishing
"Kay, Alastair; Pachos, Jiannis K; Adams, Charles S; ",Graph-state preparation and quantum computation with global addressing of optical lattices,Physical Review A,73,2,022310,2006,APS
"Byron Jr, FW; Joachain, CJ; Potvliege, RM; ",Unitarisation of the eikonal-Born series method for electron-atom and positron-atom collisions,Journal of Physics B: Atomic and Molecular Physics,15,21,3915,1982,IOP Publishing
"Soldan, Pavel; Cvitas, Marko T; Hutson, Jeremy M; Adams, Charles S; ",Interactions of cold atoms and molecules,,,,,,
"Wallis, Alisdair OG; Hutson, Jeremy M; ",Optically induced conical intersections in traps for ultracold atoms and molecules,Physical Review A,84,5,051402,2011,APS
"Elrod, MJ; Steyert, DW; Loeser, JG; Saykally, RJ; Cooper, AR; Hutson, Jeremy M; ",Experimental Determination of Three-body Forces: Far Infrared Vibration-Rotation-Tunneling Spectroscopy (FIR-VRTS) of $ Ar_ {2} HCl$,,,,,1993,Ohio State University
"West, Adam D; Hayward, Thomas J; Weatherill, Kevin J; Schrefl, Thomas; Allwood, Dan A; Hughes, Ifan G; ",A simple model for calculating magnetic nanowire domain wall fringing fields,Journal of Physics D: Applied Physics,45,9,095002,2012,IOP Publishing
